  0.000000 192.168.1.106 -> 184.106.85.30 TCP 66 42385 > ismserver [ACK] Seq=1 Ack=1 Win=1265 Len=0 TSval=44047016 TSecr=3418700214
  0.608862 192.168.1.106 -> 184.106.85.30 TCP 110 42385 > ismserver [PSH, ACK] Seq=1 Ack=1 Win=1265 Len=44 TSval=44047077 TSecr=3418700214
  0.671687 192.168.1.106 -> 184.106.85.30 TCP 133 42385 > ismserver [PSH, ACK] Seq=45 Ack=1 Win=1265 Len=67 TSval=44047083 TSecr=3418700214
  0.860372 184.106.85.30 -> 192.168.1.106 TCP 66 ismserver > 42385 [ACK] Seq=1 Ack=45 Win=6236 Len=0 TSval=3418701143 TSecr=44047077
  0.861119 184.106.85.30 -> 192.168.1.106 TCP 586 ismserver > 42385 [PSH, ACK] Seq=1 Ack=45 Win=6236 Len=520 TSval=3418701144 TSecr=44047077
  0.921551 192.168.1.106 -> 184.106.85.30 TCP 66 42385 > ismserver [ACK] Seq=112 Ack=521 Win=1310 Len=0 TSval=44047108 TSecr=3418701144
  0.922341 184.106.85.30 -> 192.168.1.106 TCP 66 ismserver > 42385 [ACK] Seq=521 Ack=112 Win=6303 Len=0 TSval=3418701206 TSecr=44047083
  0.924500 184.106.85.30 -> 192.168.1.106 TCP 489 ismserver > 42385 [PSH, ACK] Seq=521 Ack=112 Win=6303 Len=423 TSval=3418701207 TSecr=44047083
  0.926251 192.168.1.106 -> 184.106.85.30 TCP 66 42385 > ismserver [ACK] Seq=112 Ack=944 Win=1355 Len=0 TSval=44047108 TSecr=3418701207
  1.950102 192.168.1.106 -> 184.106.85.30 TCP 110 42385 > ismserver [PSH, ACK] Seq=112 Ack=944 Win=1355 Len=44 TSval=44047210 TSecr=3418701207
  2.201598 184.106.85.30 -> 192.168.1.106 TCP 66 ismserver > 42385 [ACK] Seq=944 Ack=156 Win=6347 Len=0 TSval=3418702484 TSecr=44047210
  2.203202 184.106.85.30 -> 192.168.1.106 TCP 586 ismserver > 42385 [PSH, ACK] Seq=944 Ack=156 Win=6347 Len=520 TSval=3418702485 TSecr=44047210
  2.252971 192.168.1.106 -> 184.106.85.30 TCP 66 42385 > ismserver [ACK] Seq=156 Ack=1464 Win=1400 Len=0 TSval=44047241 TSecr=3418702485
  4.261658 192.168.1.106 -> 184.106.85.30 TCP 110 42385 > ismserver [PSH, ACK] Seq=156 Ack=1464 Win=1400 Len=44 TSval=44047441 TSecr=3418702485
  4.314167 192.168.1.106 -> 184.106.85.30 TCP 133 42385 > ismserver [PSH, ACK] Seq=200 Ack=1464 Win=1400 Len=67 TSval=44047447 TSecr=3418702485
  4.513408 184.106.85.30 -> 192.168.1.106 TCP 66 ismserver > 42385 [ACK] Seq=1464 Ack=200 Win=6391 Len=0 TSval=3418704794 TSecr=44047441
  4.514981 184.106.85.30 -> 192.168.1.106 TCP 586 ismserver > 42385 [PSH, ACK] Seq=1464 Ack=200 Win=6391 Len=520 TSval=3418704795 TSecr=44047441
  4.565872 184.106.85.30 -> 192.168.1.106 TCP 66 ismserver > 42385 [ACK] Seq=1984 Ack=267 Win=6458 Len=0 TSval=3418704846 TSecr=44047447
  4.567417 184.106.85.30 -> 192.168.1.106 TCP 489 ismserver > 42385 [PSH, ACK] Seq=1984 Ack=267 Win=6458 Len=423 TSval=3418704847 TSecr=44047447
  4.610095 192.168.1.106 -> 184.106.85.30 TCP 66 42385 > ismserver [ACK] Seq=267 Ack=1984 Win=1445 Len=0 TSval=44047476 TSecr=3418704795
  4.610725 192.168.1.106 -> 184.106.85.30 TCP 66 42385 > ismserver [ACK] Seq=267 Ack=2407 Win=1490 Len=0 TSval=44047476 TSecr=3418704847
  5.802969 192.168.1.106 -> 184.106.85.30 TCP 110 42385 > ismserver [PSH, ACK] Seq=267 Ack=2407 Win=1490 Len=44 TSval=44047595 TSecr=3418704847
  6.053703 184.106.85.30 -> 192.168.1.106 TCP 66 ismserver > 42385 [ACK] Seq=2407 Ack=311 Win=6502 Len=0 TSval=3418706333 TSecr=44047595
  6.056209 184.106.85.30 -> 192.168.1.106 TCP 586 ismserver > 42385 [PSH, ACK] Seq=2407 Ack=311 Win=6502 Len=520 TSval=3418706334 TSecr=44047595
  6.148868 192.168.1.106 -> 184.106.85.30 TCP 66 42385 > ismserver [ACK] Seq=311 Ack=2927 Win=1535 Len=0 TSval=44047630 TSecr=3418706334
  6.733713 192.168.1.106 -> 184.106.85.30 TCP 110 42385 > ismserver [PSH, ACK] Seq=311 Ack=2927 Win=1535 Len=44 TSval=44047688 TSecr=3418706334
  6.793598 192.168.1.106 -> 184.106.85.30 TCP 133 42385 > ismserver [PSH, ACK] Seq=355 Ack=2927 Win=1535 Len=67 TSval=44047694 TSecr=3418706334
  6.985183 184.106.85.30 -> 192.168.1.106 TCP 66 ismserver > 42385 [ACK] Seq=2927 Ack=355 Win=6546 Len=0 TSval=3418707264 TSecr=44047688
  6.986434 184.106.85.30 -> 192.168.1.106 TCP 586 ismserver > 42385 [PSH, ACK] Seq=2927 Ack=355 Win=6546 Len=520 TSval=3418707265 TSecr=44047688
  7.045580 184.106.85.30 -> 192.168.1.106 TCP 66 ismserver > 42385 [ACK] Seq=3447 Ack=422 Win=6613 Len=0 TSval=3418707324 TSecr=44047694
  7.046117 184.106.85.30 -> 192.168.1.106 TCP 489 ismserver > 42385 [PSH, ACK] Seq=3447 Ack=422 Win=6613 Len=423 TSval=3418707325 TSecr=44047694
  7.069791 192.168.1.106 -> 184.106.85.30 TCP 66 42385 > ismserver [ACK] Seq=422 Ack=3447 Win=1580 Len=0 TSval=44047722 TSecr=3418707265
  7.070518 192.168.1.106 -> 184.106.85.30 TCP 66 42385 > ismserver [ACK] Seq=422 Ack=3870 Win=1625 Len=0 TSval=44047722 TSecr=3418707325
  7.814222 192.168.1.106 -> 184.106.85.30 TCP 110 42385 > ismserver [PSH, ACK] Seq=422 Ack=3870 Win=1625 Len=44 TSval=44047796 TSecr=3418707325
  8.066853 184.106.85.30 -> 192.168.1.106 TCP 66 ismserver > 42385 [ACK] Seq=3870 Ack=466 Win=6657 Len=0 TSval=3418708343 TSecr=44047796
  8.067867 184.106.85.30 -> 192.168.1.106 TCP 586 ismserver > 42385 [PSH, ACK] Seq=3870 Ack=466 Win=6657 Len=520 TSval=3418708344 TSecr=44047796
  8.095250 192.168.1.106 -> 184.106.85.30 TCP 66 42385 > ismserver [ACK] Seq=466 Ack=4390 Win=1670 Len=0 TSval=44047825 TSecr=3418708344
